{
  "documents": {
    ".github/PULL_REQUEST_TEMPLATE.md": {
      "content_type": "policy",
      "fenced_blocks": [],
      "reader_action": "Provide reviewable pull-request evidence.",
      "source_fingerprint": "sha256:dcdd4fb6ecd21f44c8855bfb620cc6f0535acab0a13333d8ad7d35c9a70bfed6",
      "sources": [
        "CONTRIBUTING.md",
        ".github/workflows/ci.yml"
      ]
    },
    "AGENTS.md": {
      "content_type": "policy",
      "fenced_blocks": [
        {
          "classification": "exact_release_cutover_proof",
          "id": "agents.md.block-1",
          "language": "bash",
          "sha256": "833432688a9e6d230c4d7ca18587178b5cbeef9548e178cc9ae48a9a7c0afa92",
          "verification_id": "manual.release-cutover"
        },
        {
          "classification": "exact_release_cutover_proof",
          "id": "agents.md.block-2",
          "language": "bash",
          "sha256": "d6e181be67af40bfe717caf4622d78864f6a9b7b5c1c9537be93cf4093b4e60b",
          "verification_id": "manual.release-cutover"
        }
      ],
      "reader_action": "Apply repository engineering constraints.",
      "source_fingerprint": "sha256:e4c6ed6295333ead86c94c0937e3d4b5f4389e1bf5d7ed8f48c411ada581bcd0",
      "sources": [
        "Makefile",
        "pyproject.toml",
        "src/fieldkit/__main__.py"
      ]
    },
    "CONTRIBUTING.md": {
      "content_type": "how-to",
      "fenced_blocks": [
        {
          "classification": "exact_release_cutover_proof",
          "id": "contributing.md.block-1",
          "language": "console",
          "sha256": "7769f7deff0e0af7477e292816063efb24722c38e8b10f29f0d2baae99ebaca5",
          "verification_id": "manual.release-cutover"
        },
        {
          "classification": "exact_release_cutover_proof",
          "id": "contributing.md.block-2",
          "language": "console",
          "sha256": "de37eb43fbe796870e17f158c0696c72908d2332014bee4185e55349cf0da82d",
          "verification_id": "manual.release-cutover"
        }
      ],
      "reader_action": "Prepare and submit a contribution.",
      "source_fingerprint": "sha256:b4e13948691d3a5213f4c941be3e3dc9917b109323abcc6a210f33a39728a397",
      "sources": [
        "Makefile",
        "pyproject.toml",
        ".github/workflows/ci.yml"
      ]
    },
    "GOVERNANCE.md": {
      "content_type": "policy",
      "fenced_blocks": [],
      "reader_action": "Understand current project authority.",
      "source_fingerprint": "sha256:fd6d717f939e30b17d8b57dffc9d61912a1c8d06af33a4f4f0d848a0f24ac748",
      "sources": [
        ".github/CODEOWNERS",
        ".github/repository-settings.json"
      ]
    },
    "README.md": {
      "content_type": "overview",
      "fenced_blocks": [
        {
          "classification": "exact_release_cutover_proof",
          "id": "readme.md.block-1",
          "language": "console",
          "sha256": "4fb449ef8f276bdd57515b4076d4987460537f112469df56b26cc4275780a87d",
          "verification_id": "manual.release-cutover"
        },
        {
          "classification": "safe_automated_command",
          "id": "readme.md.block-2",
          "language": "console",
          "sha256": "91a6fd59a2ed21a20a416ef122a94d2f1a86a092f4ce2880539e41821795ab2c",
          "verification_id": "automated.installed-base-artifact"
        },
        {
          "classification": "exact_release_cutover_proof",
          "id": "readme.md.block-3",
          "language": "console",
          "sha256": "b6b9bd4f55fa4c0266c5b7a3625f02c7d3923128371089f3f8211529da305af7",
          "verification_id": "manual.release-cutover"
        },
        {
          "classification": "exact_release_cutover_proof",
          "id": "readme.md.block-4",
          "language": "console",
          "sha256": "92cee7cfe332837c7bca8da6569042da6f9586496bc30ba694be157f9122fdf6",
          "verification_id": "manual.release-cutover"
        }
      ],
      "reader_action": "Choose an installation or contribution path.",
      "source_fingerprint": "sha256:e696f802afb88714a28f2b54e72b146e2a7d80feee6e12193f3faa166951f139",
      "sources": [
        "pyproject.toml",
        "src/fieldkit/__main__.py",
        ".github/workflows/compatibility.yml"
      ]
    },
    "RELEASING.md": {
      "content_type": "how-to",
      "fenced_blocks": [
        {
          "classification": "exact_release_cutover_proof",
          "id": "releasing.md.block-1",
          "language": "console",
          "sha256": "0a6138b5aff5ec91e22d1c67ff41ed9b9d8cbca1d2edc1d615fd9568e009d9e7",
          "verification_id": "manual.release-cutover"
        },
        {
          "classification": "exact_release_cutover_proof",
          "id": "releasing.md.block-2",
          "language": "console",
          "sha256": "91d306195af669a48193a600aca9ba56e75563c75c04369c8266cea18fb67f13",
          "verification_id": "manual.release-cutover"
        },
        {
          "classification": "safe_automated_command",
          "id": "releasing.md.block-3",
          "language": "console",
          "sha256": "c7132074ad25264fb2a98516db30d7c0a546b1b668cac64e671e1c282e1421df",
          "verification_id": "automated.release-workflow-policy"
        },
        {
          "classification": "exact_release_cutover_proof",
          "id": "releasing.md.block-4",
          "language": "console",
          "sha256": "50a2887392175a0bde98a73e4a63398f2644c0204a51eb514358d94235e9ded3",
          "verification_id": "manual.release-cutover"
        }
      ],
      "reader_action": "Prepare, assess, and recover an operator-approved release candidate.",
      "source_fingerprint": "sha256:5cd38e25d33bcf2df380877dcea72d50ff7de84f09ce3ddfdfa049b5dbbebd06",
      "sources": [
        "Makefile",
        ".github/workflows/release.yml",
        ".github/workflows/release-approval.yml",
        "docs/release-readiness/release-policy.json",
        "docs/release-readiness/release-governance-policy.json",
        "scripts/check_release_consumer.py"
      ],
      "tables": [
        {
          "classification": "exact_release_cutover_proof",
          "id": "releasing.md.table-1",
          "sha256": "35b71f5d88f8708f9b28441eb64327f5daf6b64934f825403c2ba37a589d4bb4",
          "verification_id": "manual.release-cutover"
        }
      ]
    },
    "ROADMAP.md": {
      "content_type": "roadmap",
      "fenced_blocks": [],
      "reader_action": "Review planned work.",
      "source_fingerprint": "sha256:9bc4fffd1b32142941560225b1caf6eb59cff895600766e3d90cd478e979818e",
      "sources": [
        ".github/repository-settings.json",
        "pyproject.toml",
        "scripts/check_roadmap_contract.py"
      ],
      "tables": [
        {
          "classification": "structural_assertion",
          "id": "roadmap.md.table-1",
          "sha256": "e6757393fb9e8bff21282729d225783cfec3e285da8c92877c200e7411c90e34",
          "verification_id": "automated.roadmap-contract"
        },
        {
          "classification": "structural_assertion",
          "id": "roadmap.md.table-2",
          "sha256": "9d1d7deaa2511b27ca9267de30eba6dd67d3d09e112673917312691b4536bda0",
          "verification_id": "automated.roadmap-contract"
        },
        {
          "classification": "structural_assertion",
          "id": "roadmap.md.table-3",
          "sha256": "fd6239298e68d865a508c843bdd05f6f1f7fd77ed8116a63c8da4bbb86c78395",
          "verification_id": "automated.roadmap-contract"
        },
        {
          "classification": "structural_assertion",
          "id": "roadmap.md.table-5",
          "sha256": "291f11b2f940661061646762b7e81919fb06616960c8a7398998e32cb71f71ce",
          "verification_id": "automated.roadmap-contract"
        },
        {
          "classification": "structural_assertion",
          "id": "roadmap.md.table-6",
          "sha256": "df50874b36665bb1508728b57deefe2ca28adcb74a785a93148254f0481358e2",
          "verification_id": "automated.roadmap-contract"
        }
      ]
    },
    "SECURITY.md": {
      "content_type": "policy",
      "fenced_blocks": [],
      "reader_action": "Report a vulnerability without public disclosure.",
      "source_fingerprint": "sha256:49cd42a0609f67a3af799e6de89233b75382e69de87c836abdb6f1f5f97b059b",
      "sources": [
        ".github/repository-settings.json",
        ".github/ISSUE_TEMPLATE/config.yml"
      ],
      "tables": [
        {
          "classification": "exact_release_cutover_proof",
          "id": "security.md.table-1",
          "sha256": "391f708f84cd3f835cb09dddc1bf5b5f6d9a29ac232e5fefa2f8a8f983d11ed8",
          "verification_id": "manual.release-cutover"
        }
      ]
    },
    "SUPPORT.md": {
      "content_type": "policy",
      "fenced_blocks": [],
      "reader_action": "Choose the correct support route.",
      "source_fingerprint": "sha256:2558ee5ca269fb00738365af69df089d15c877657f5a44db07c96855874ce646",
      "sources": [
        ".github/ISSUE_TEMPLATE/config.yml",
        ".github/ISSUE_TEMPLATE/*.yml"
      ]
    },
    "THREAT_MODEL.md": {
      "content_type": "policy",
      "fenced_blocks": [],
      "reader_action": "Assess the supported security boundary before enabling an integration or reporting a vulnerability.",
      "source_fingerprint": "sha256:9072e962e3a83bb98d1f645f0f312399cc2ace48348ce130e28f7ac8767dd602",
      "sources": [
        "SECURITY.md",
        "docs/privacy.md",
        "src/fieldkit/cli_exit.py"
      ],
      "tables": [
        {
          "classification": "structural_assertion",
          "id": "threat-model.md.table-1",
          "sha256": "99046283e7a95d41b3d8ce54859dc6b40490e3608af8c74ed1795bb19f175867",
          "verification_id": "automated.documentation-contract"
        }
      ]
    },
    "docs/adr/0001-local-first-roots.md": {
      "content_type": "policy",
      "fenced_blocks": [],
      "reader_action": "Place new state in the correct configured root.",